{
    "label_map": {
        "1": "Figure",
        "2": "Table"
    },
    "info": {
        "schema_version": "1.3",
        "type": "prediction",
        "created_at": "2026-03-11T16:28:08Z",
        "run_id": "tfid-7f90c4395f",
        "model": {
            "name": "yifeihu/TF-ID-large",
            "version": "unknown",
            "notes": "adapter=tfid; device=cpu; dpi=300"
        },
        "coordinate_system": {
            "type": "normalized_xyxy",
            "range": [
                0.0,
                1.0
            ],
            "origin": "top_left"
        }
    },
    "documents": [
        {
            "doc_id": "202501_bn_older_refugees_moldova_eng.pdf",
            "doc_name": "202501_bn_older_refugees_moldova_eng.pdf",
            "doc_path": "pdf_input/202501_bn_older_refugees_moldova_eng.pdf"
        },
        {
            "doc_id": "230306_afg_protection_analysis_updates_february_2023.pdf",
            "doc_name": "230306_afg_protection_analysis_updates_february_2023.pdf",
            "doc_path": "pdf_input/230306_afg_protection_analysis_updates_february_2023.pdf"
        },
        {
            "doc_id": "3rp-media-backgrounder.pdf",
            "doc_name": "3rp-media-backgrounder.pdf",
            "doc_path": "pdf_input/3rp-media-backgrounder.pdf"
        },
        {
            "doc_id": "5fb3ad4d4.pdf",
            "doc_name": "5fb3ad4d4.pdf",
            "doc_path": "pdf_input/5fb3ad4d4.pdf"
        },
        {
            "doc_id": "68487.pdf",
            "doc_name": "68487.pdf",
            "doc_path": "pdf_input/68487.pdf"
        },
        {
            "doc_id": "analyse_environnement_de_protection_des_regions_de_segou_san_v2_final.pdf",
            "doc_name": "analyse_environnement_de_protection_des_regions_de_segou_san_v2_final.pdf",
            "doc_path": "pdf_input/analyse_environnement_de_protection_des_regions_de_segou_san_v2_final.pdf"
        },
        {
            "doc_id": "civil_documentation_factsheet_final.pdf",
            "doc_name": "civil_documentation_factsheet_final.pdf",
            "doc_path": "pdf_input/civil_documentation_factsheet_final.pdf"
        },
        {
            "doc_id": "intersos_-_rapport_mensuel_de_protection_aout_2020_-boucle_du_mouhoun_-_version_du_10-09-2020.pdf",
            "doc_name": "intersos_-_rapport_mensuel_de_protection_aout_2020_-boucle_du_mouhoun_-_version_du_10-09-2020.pdf",
            "doc_path": "pdf_input/intersos_-_rapport_mensuel_de_protection_aout_2020_-boucle_du_mouhoun_-_version_du_10-09-2020.pdf"
        },
        {
            "doc_id": "jordanhaus2015finalreport-2.pdf",
            "doc_name": "jordanhaus2015finalreport-2.pdf",
            "doc_path": "pdf_input/jordanhaus2015finalreport-2.pdf"
        },
        {
            "doc_id": "rapport_mensuel_monitoring_de_protection_de_la_region_de_maradi_au_niger_octobre_2022.pdf",
            "doc_name": "rapport_mensuel_monitoring_de_protection_de_la_region_de_maradi_au_niger_octobre_2022.pdf",
            "doc_path": "pdf_input/rapport_mensuel_monitoring_de_protection_de_la_region_de_maradi_au_niger_octobre_2022.pdf"
        }
    ],
    "predictions": [
        {
            "page_id": "202501_bn_older_refugees_moldova_eng.pdf::p000",
            "doc_id": "202501_bn_older_refugees_moldova_eng.pdf",
            "page_index": 0,
            "objects": [
                {
                    "id": "202501_bn_older_refugees_moldova_eng.pdf::p000:0",
                    "label": "Figure",
                    "bbox": [
                        0.4995000133775685,
                        0.48349998887108264,
                        0.9685000558710214,
                        0.7334999888710826
                    ],
                    "score": 1.0
                }
            ]
        },
        {
            "page_id": "202501_bn_older_refugees_moldova_eng.pdf::p002",
            "doc_id": "202501_bn_older_refugees_moldova_eng.pdf",
            "page_index": 2,
            "objects": [
                {
                    "id": "202501_bn_older_refugees_moldova_eng.pdf::p002:0",
                    "label": "Figure",
                    "bbox": [
                        0.5185000460345739,
                        0.0004999999986414896,
                        0.9985000401327054,
                        0.3834999888710826
                    ],
                    "score": 1.0
                }
            ]
        },
        {
            "page_id": "230306_afg_protection_analysis_updates_february_2023.pdf::p001",
            "doc_id": "230306_afg_protection_analysis_updates_february_2023.pdf",
            "page_index": 1,
            "objects": [
                {
                    "id": "230306_afg_protection_analysis_updates_february_2023.pdf::p001:0",
                    "label": "Figure",
                    "bbox": [
                        0.07449999640969669,
                        0.17049998890269885,
                        0.9194999425551471,
                        0.43849997780539773
                    ],
                    "score": 1.0
                }
            ]
        },
        {
            "page_id": "230306_afg_protection_analysis_updates_february_2023.pdf::p004",
            "doc_id": "230306_afg_protection_analysis_updates_february_2023.pdf",
            "page_index": 4,
            "objects": [
                {
                    "id": "230306_afg_protection_analysis_updates_february_2023.pdf::p004:0",
                    "label": "Figure",
                    "bbox": [
                        0.07449999640969669,
                        0.17449999260179924,
                        0.9175,
                        0.4764999852035985
                    ],
                    "score": 1.0
                }
            ]
        },
        {
            "page_id": "230306_afg_protection_analysis_updates_february_2023.pdf::p005",
            "doc_id": "230306_afg_protection_analysis_updates_february_2023.pdf",
            "page_index": 5,
            "objects": [
                {
                    "id": "230306_afg_protection_analysis_updates_february_2023.pdf::p005:0",
                    "label": "Figure",
                    "bbox": [
                        0.07449999640969669,
                        0.1875,
                        0.9194999425551471,
                        0.43849997780539773
                    ],
                    "score": 1.0
                }
            ]
        },
        {
            "page_id": "230306_afg_protection_analysis_updates_february_2023.pdf::p008",
            "doc_id": "230306_afg_protection_analysis_updates_february_2023.pdf",
            "page_index": 8,
            "objects": [
                {
                    "id": "230306_afg_protection_analysis_updates_february_2023.pdf::p008:0",
                    "label": "Figure",
                    "bbox": [
                        0.08049999760646447,
                        0.16549998890269887,
                        0.9164999808517157,
                        0.670499970407197
                    ],
                    "score": 1.0
                }
            ]
        },
        {
            "page_id": "3rp-media-backgrounder.pdf::p001",
            "doc_id": "3rp-media-backgrounder.pdf",
            "page_index": 1,
            "objects": [
                {
                    "id": "3rp-media-backgrounder.pdf::p001:0",
                    "label": "Table",
                    "bbox": [
                        0.12549999134043732,
                        0.4804999983297107,
                        0.7004999716596131,
                        0.6864999838538697
                    ],
                    "score": 1.0
                },
                {
                    "id": "3rp-media-backgrounder.pdf::p001:1",
                    "label": "Figure",
                    "bbox": [
                        0.14050000216489067,
                        0.7395000044541049,
                        0.8635000023616989,
                        0.8954999482210305
                    ],
                    "score": 1.0
                },
                {
                    "id": "3rp-media-backgrounder.pdf::p001:2",
                    "label": "Figure",
                    "bbox": [
                        0.12549999134043732,
                        0.23849998830797464,
                        0.8685000141701935,
                        0.6864999838538697
                    ],
                    "score": 1.0
                }
            ]
        },
        {
            "page_id": "5fb3ad4d4.pdf::p004",
            "doc_id": "5fb3ad4d4.pdf",
            "page_index": 4,
            "objects": [
                {
                    "id": "5fb3ad4d4.pdf::p004:0",
                    "label": "Figure",
                    "bbox": [
                        0.07749999867422956,
                        0.2234999874988234,
                        0.9205000434852701,
                        0.7104999588196537
                    ],
                    "score": 1.0
                }
            ]
        },
        {
            "page_id": "5fb3ad4d4.pdf::p005",
            "doc_id": "5fb3ad4d4.pdf",
            "page_index": 5,
            "objects": [
                {
                    "id": "5fb3ad4d4.pdf::p005:0",
                    "label": "Table",
                    "bbox": [
                        0.07450000391102278,
                        0.11749999494437711,
                        0.9205000434852701,
                        0.7174999742622835
                    ],
                    "score": 1.0
                }
            ]
        },
        {
            "page_id": "5fb3ad4d4.pdf::p006",
            "doc_id": "5fb3ad4d4.pdf",
            "page_index": 6,
            "objects": [
                {
                    "id": "5fb3ad4d4.pdf::p006:0",
                    "label": "Table",